<?xml version="1.0" encoding="UTF-8"?>
<!DOCTYPE agenda SYSTEM "agenda.dtd">
<agenda>
    <contatto>
        <nome>PincoPallino</nome>
    <indirizzo>
        <via>Via Incognita</via>
        <numero>10</numero>
        <citta>Bologna</citta>
        <cap>&BO;</cap>
    </indirizzo>
    <telefono>050-123456</telefono>
    <telefono tipo="ufficio">051-123456</telefono>
    <email>pinco@email.com</email>
    <foto src="pinco.gif" desc="acunamatata"></foto>
    </contatto>
</agenda>